control, de se, agreement, attitude predicates, feature transmission
Sociolinguistics, Spanish in NYC, Bilingualism, Subjunctive, Simplification, Spanish in contact, Spanish Mood
Split vP, Unaccusativity, Dispositions, German, Syntax-Semantics Interface, Voice, Causality, Thematic Roles
contrast, focus, information structure, inquisitive semantics
control, implicit arguments, passives, Visser's Generalization, Germanic
conjunction, formal semantics, lambda calculus
Social function, mean, communication, Turkic culture, social changes
Quantity implicatures, facts, Embedded implictures, Hurford's constraint
control, propositional attitudes, thematic uniqueness, coercion, causatives
modals, tense, states, epistemics
Russian causatives, control, presupposition, assertion, negation scope
sluicing, case-marking, Japanese, Dynamic Syntax, semantic tree growth
Temporal categories, Graded Tense, Medumba, Grassfields Bantu
imperatives, quantification, modality
Hindi, Correlatives, Degrees
epistemic modality, evidentiality, probabilistic semantics, must
Direct Compositionality, Pronouns, Minimalist Grammars, Inverse linking
Plurality inferences, Plurals, Scalar implicatures, Acquisition, Experimental semantics
intensionality, referring expressions, opacity, perspectives / mental attitudes, category theory
Intensifiers, Centrality, Semantics, Adverbs, Information Structure
modality, gradability, comparatives, German
Progressive, Polarity, Modality, Non-veridicality, Mandarin Chinese
modals, japanese, politeness, deontic, priority
event semantics, Case licensing, Japanese/English
conversational implicature, exhaustivity, epistemic step
Mandarin Chinese, focus adverbs, exclusive, scalar particle, contrastive topic
evidentials, modals, polarity sensitive item, exhaustification
plural quantification, mass quantification, homogeneity constraint
DRT, Grammatical Gender, Anaphora Resolution, Sign Language
aspect, realis/irrealis, evidentials, change-of-state, first hand knowledge, second hand information, inference
can, modal, Odia
dependent type, generalized quantifier, unbound anaphora
additive particles, comparatives, directed scale segments
locative, indefinite, property, eigenspace, non-existential
Counterfactuality, Gricean Conventional Implicature, Possibility modal, Spanish
manner adjectives, substitution failure, -er nominals, bracketing paradox, defective gerunds
plural predication, plurality, conjunction, typicality effects, vagueness
universal quantifiers, PPI, exhaustification, modals, negation
contextualism, context-sensitivity, epistemic modals, disagreement, attitude reports
Presuppositions, At-Issueness, Experimental Semantics
semantics, approximatives, exhaustification, scope relations
complement coercion, compositionality, incorporation, locality
Modified numeral, Question under discussion, Experiment
evidentiality, temporality, multidimensional modality
Attitude reports, Nonspecific de re, Cognitive context
number determiners, how many-questions, the average N
semantics of again, counterdirectional again, restitutive again, structural ambiguity, lexical ambiguity
syntax-semantics interface, Categorial Minimalist Grammars, Dynamic Continuation Semantics, lambda-calculus
Square of opposition, Generalized quantifiers, Topical restriction, Focal restriction
scalar particle, even, only, French
questions, alternative questions, negation, exhaustivity in questions, negative polarity
M-possessives, genericity, Bangla, semantics
Proportional quantification, Extensionality, Scalar predicates
Presupposition, Scalar implicature, Ignorance
binding, ellipsis, antecedent-contained deletion, variables, assignment functions
Counterfactuals, Counterpossibles, Possible World Semantics
Rhetorical relations, Constructionist theory, propositional inferences, linguistic markers
verbal number, plurality, distributivity, Karitiana, Tupi language
Aspect, Events, Adjectival passives, German, Spanish
copula, identity sentences, attitude reports
NP, Demonstratives, Adjectives, Possessors, Chinese, Serbo-Croatian
arbitrary pronoun, corporate they, novel definite, German
alternative semantics, approximation, number, modification
focus, Hungarian, exhaustivity, event-semantics
evidentiality, speaker bias, polar questions, Bangla
alternatives, scalar implicatures, symmetry
de se, de re, attitude report, empathy, Chinese ziji
politeness, complexity, Gale-Stewart games
indefinite articles, plurality, for-adverbials, Romance
Modern Type Theories, Hyperintensionality, Belief Contexts, Coercive Subtyping
Questions, Adjectives, Type Theory, Semantic Ontology
quantifier raising, global economy, child language acquisition, interfaces, inverse scope
model-theoretic semantics, aspect, branching time
as-parentheticals, focus, typology of parentheticals
amount (or degree) relatives, there-existentials, Genitive of Negation/Intensionality in Russian, comparatives, Type shifting
verval prefixes, event structure, aspect, telicity, scalarity, Russian
control, anaphora, DRT, de se
experiencer phrases, variadic operators, evaluative predicates, contextualism, relativism
discourse referents, propositional discourse elements, metalinguistic negation, speech acts, expositives, J. L. Austin, numerals, belief
factive use of the subjunctive, decision theory, German
Rhetorical Questions, Question Semantics, Japanese
taste, beauty, relativism, faultless disagreement, normativity, descriptive / interpretational usage, common ground, individual discourse commitments
similarity, demonstratives, kinds, measure functions, multidimensional attribute spaces, indistinguishability, sameness
modal concord, prosody, epistemic modality
modality, extreme adjectives, scale semantics, gradability, comparatives
goal-oriented comparisons, information structure, conventional implicature, Japanese
computational semantics, imperfective paradox, mereology
Evidentials, Assertion, Perspective Shift, Reported Speech
higher order anaphors, higher order comparatives, predicate invariance, argument invariance
Evidentiality, Future, French, Italian, Romanian
scalar implicatures, pragmatic processing, reaction times
Aktionsart, Tense, Aspect, Vietnamese
modals, speech acts, subjunctive, evaluative predicates
Ga (Kwa Niger-Congo), Imperfective, focus semantics
focus intervention effects, association between focus operators and wh-phrases, Hamblin semantics
Contrastive Topic, Conventional Scalar Implicature, information structure, QUD, Potential Topic, list Contrastive Topic, cross-linguistic phenomenon, 'too' clause
universal quantification, maximality, definiteness, intensional FCI, Mandarin
negation, semantic change, ambiguity, French, Romance
Downward Entailment, Language Acquisition, Negative Polarity Items (NPIs), Negation, Non-veridicality
embedded irony, attitude embedding, attitude projection, ironic speech-act, expressivism
orders of language, expressive verbs, semantic fields, metalinguistic functions
Modality, Modal particles, Norwegian
possession, reflexivization, focus
questions, answers, DRT
VP Ellipsis, Question Under Discussion, Strict and sloppy identity, Parallelism, Focus, Information structure
Quantifier Raising, Antecedent Contained Deletion, Hackl et al effect, On Line processing, Logical Form
privative adjectives, individual-level predicates, intersectivity, membership
Exceptive, Presupposition, French
alternative semantics, compositionality, inquisitive semantics
Question semantics, Partition theory of questions, Inquisitive semantics
count/mass, nominal semantics, complex numbers, Czech
Compositionality, Probability, Prototypes
implicature, alternatives, economy, exhaustification
Focus, Scale-Reversal, Modality, Intonation, Emphasis
decomposition, superlatives, language change, syntax-semantics interface
epistemic indefinites, epistemic modals, evidentiality, Czech, Slavic
modal verbs, evidentially, intentionality, speech acts, events
modality, possible worlds, inertia worlds, gradability, almost
perfectivity, aspect, possible worlds, branching futures, specificity
dependent plurals, Hamblin alternatives, distributivity, scope
metalinguistic degree morphemes, attenuation, modal particles
Counterfactuals, Angelika Kratzer, Premise semantics, Counterfactual logic, Causal models, Judea Pearl
Discourse topic, QUD, Right Frontier Constraint, Rhetorical structure, Information Structure
conditionals, temporal adverbials, focus, clefts, definite descriptions, situation semantics, information structure
additivity, scalarity, prosody, Basque particle 'ere'
Quantification, Universal Quantifiers, Verification Procedure, Restrictedness, Analogue Magnitude System
scalar implicatures, prosody, "uncertainty" contour, perception experiment
donkey anaphora, descriptions, free choice items
Non-core dative, Affectedness, Presupposition, Modern Hebrew
Implicatures, Hurford's Constraint, Exhaustification, Disjunction, Formal Pragmatics
quantification, German, conservativity, focus, syntax
Multi-dimensional semantics, Expressives, Focus, Metalinguistic negation, Gestures
conditional question, inquistive semantics, Hamblin semantics, implicature
Deontic Modality, Premise Semantics, Scalar Semantics, Probability Operators
Questions, Semantic Ontology, Type Theory with Records, Dialogue
Conventional implicature, Presupposition, Projection, DRT, At-issueness
Modified numerals, Scalar quantification, Conversational implicatures
scalar implicature, only, exhaustification, contextual standard, alternatives, situation semantics, question under discussion
yes/no questions, bias, evidentiality
Geach sentence, Right-Node Raising, scope parallelism, Type-Logical Categorial Grammar
comparatives, continuations, semantics
Counterfactuality, Attitude reports, De re
Experimental semantics, Attitude reports, De se and de re
Pragmatics, Focus sensitivity, Questions-Under-Discussion
individual-level/stage-level predicates, states, ser/estar alternation, Spanish
evidentials, reports, discourse structure, main point content
Count/mass distinction, Numerals, Yudja, Quantity judgments
Focus, Scalar particle, Presupposition, Mandarin Chinese
domain restriction, exceptions, genericity, universal quantification
adversative coordination, but, focus, exhaustivity, ellipsis, negation, correction
executive function, gradable adjectives, scalar implicature, semantic memory, social cognition
predicates of personal taste, implicature, presupposition, projection, assertion
degrees, amount relatives, measurement
adjectives, gradability, social dimension
Modality, Dr. Procrastinate puzzle, Inquisitive Semantics, Suppositions
Miners puzzle, Deontic and epistemic modals, Inquisitive Semantics, Deontic conflict
pronouns, person features, imposters
Russellianism, belief reports, belief-state reports, substitution salva veritate, Millian names
indexical shift, long-distance reflexive, de se
want, focus, deliberative modality
syntax morphology interface, scope, causative, Karachay-Balkar, Tatar
interrogatives, knowledge wh, experimental semantics
conditionals, only, quantifiers
Modality, Indexicality, Evidentiality, Tagalog
degree semantics, experimental semantics, gradable adjectives, comparatives, equatives, evaluativity, context-sensitivity
Hungarian, aspect, discourse marker, precisifier
polar questions, negative polarity items, conditional perfection
expressive meaning, diachronic semantics, mixed expressives, Italian, Cantonese
temporal pluractionality, scalar pluractionality, reduplicative adverbs
biscuit conditional, question, independence, dynamic semantics, partition semantics
Partitives, Ellipsis, NP anaphors, Italian, Syntax/Semantics Interface
coordination, disjunction, Australian Aboriginal languages, Warlpiri
at-issueness, demonstratives, gestures
Coordination, Abstract nouns, Events, Situations, Lexical Semantics
Alternative questions, Yes/No questions, Disjunction, Cross-linguistic variation
epistemicity, indefinites, Sinhala
locations, property theory, relative clauses
givenness, deaccentuation, contrast, question under discussion, alternative, adjectival modification
definites, uniqueness, salience, Bantu, Bulu
rice, rice term, concept, conceptualization, generic term, generalization
interpretation, text, neo-saussurian
presuppositions, pragmatic processing, visual world paradigm
Distributivity, Reciprocity, Reflexivity, Event semantics
tense, language acquisition, French, futurate readings
Counterfactual Conditionals, Perfect aspect, fake/modal use, Korean
numeral modifiers, decreasing quantifiers, distributivity, scope interaction
relative/absolute gradable adjectives, scale structures, vagueness, probabilistic modeling
Exhaustivity operator, Expletive negation, Scalar meaning, Until clause, Spanish
Russian, Slavic, presupposition, focus, adverbial quantification
anaphora, information structure, pragmatics
conditionals, situations, locatives
Exhaustification, Polarity items, Focus
Counterfactuals, only if conditional, scalar implicature, possible worlds, ordering source
pronoun, anaphora, NP ellipsis
Mild adjectives, Vagueness, Gradability, Evaluativity, Extreme adjectives
lexical semantics, frames, semantic nets
gradability, vagueness, progressive
comparatives, perspective, judge-dependence, grammaticalization, Turkish
exactly, alternatives, semantics/pragmatics
Discourse structure, Conditionals, Discourse reference, Discourse markers
Categorization Verbs, Lexical Features, Argument Structure, Predication Theory
Epistemic modality, Adverbs, DP modification
compositional semantics, discourse representation theory, adjectival modification, privative adjectives, fake, counterfeit, Non-vacuity Principle, optimization
lexical aspect, incompleteness, accomplishments, American Sign Language
contrastive focus, alternative question, exactly one disjunct holds
reference de se, conjunct/disjunct, mirativity
Contradiction and Grammar, Why-question, Wh-in situ, Strong Islands, East Asian Languages
polyadic predicates, polyadicity, verbs with optional complements, causative verbs
slurs, speech acts, slurring utterances
Russian, Aspect, Presupposition, Scalar Implicatures
pragmatics, exhaustive inferences, implicature, polarity-mismatching Q/A pairs
Cooperative Principle, Implicatures, Hearer understanding
Bridging, Possessives, Definiteness, Accommodation, Cross-reference
Predicates of personal taste, Presuppositions, Opinion verbs, Conjunction
superlative, relative reading with NP internal focus, syntax-semantics interface
focus movement, scope economy, scope fixing, alternative semantics
domain restriction in definites, definite articles, article-omission, Swedish, context-sensitive modifiers
Polarity Sensitive, Free Choice, Quantification
relatives, reconstruction, complements, small clauses, Italian, direct/indirect perception
strict conditionals, counterfactuals, sobel sequences
subset comparatives, comparative quantifiers, comparatives
wh-conditionals, focus, alternatives, Mandarin (Chinese)
focus, negation, dynamic semantics, Mayan
Superlatives, Definiteness, Type shifting, Existence presupposition, Uniqueness presupposition
Pragmatics, Bayesian models, Probabilistic models, Rational speech-act theory, Corpus data, Conversational Implicature
Imprecision, Granularity, Comparison
Property Concepts, Comparison, Adjectives, Dravidian, Telugu
quotation, events, act-based semantics, pronouns
remember, forget, reference time, knowledge
evidentials, embedded speech acts, cross-linguistic variation
negative polarity items, Immediate Scope Constraint, stress, information structure
projection, information structure, focus marking, context, (semi-)factives, soft triggers
focus, Bantu, Kuria
ser/estar distinction, modals, Spanish
collective predicates, all, mereology, stratified reference
anaphora, presupposition, projection, accommodation, resolution, satisfaction, dynamic semantics
mass nouns, semantic variation, semantic universals, cross-linguistic semantics
negative antonyms, van Benthems problem, exhaustification
conjunctions, implicatures, semantic vs. pragmatic theories of scalar implicatures, disjunctions, Hurford's constraint
gradability, degrees, stativity, Wolof, ontology
same, distributivity, Chinese
Albanian, Modern Greek, negative polarity items, free choice items, non-veridicality
focus, exhaustivity, exclusive
Quantifiers, Psychophysics, Verification